{
  "$schema": "http://json-schema.org/draft-07/schema#",
  "$id": "https://navi-chart.local/schema/report.schema.json",
  "title": "Navi Chart report catalog entry",
  "description": "One full-page report template. See docs/adr/0002-catalog-as-data.md.",
  "type": "object",
  "additionalProperties": false,
  "required": [
    "id",
    "name",
    "zh_title",
    "common_types",
    "page_width",
    "density",
    "color_system",
    "dependencies",
    "origin"
  ],
  "properties": {
    "id": {
      "type": "string",
      "pattern": "^R[0-9]{2}$"
    },
    "name": {
      "type": "string",
      "minLength": 1,
      "description": "English display name, e.g. 'Survey One-Pager'."
    },
    "zh_title": {
      "type": "string",
      "minLength": 1,
      "description": "The established Chinese display name, preserved per docs/design-language/UNKNOWNS.md U3 so a Chinese-language delivery doesn't lose it."
    },
    "common_types": {
      "type": "array",
      "items": { "type": "string" },
      "description": "Recommended report types / transferable scenarios. Non-binding on content type per report-catalog.md's selection principle — judge by structure, not by the industry a name suggests."
    },
    "page_width": {
      "type": "string",
      "description": "Fixed canvas width in px, or WxH for a locked social-card size (e.g. '1080', '600x1000')."
    },
    "density": {
      "type": "string",
      "description": "Chart count and information density, e.g. '3 charts, medium'."
    },
    "color_system": {
      "type": "string",
      "enum": ["Mono", "Porcelain", "Palm", "Wire"]
    },
    "dependencies": {
      "type": "string",
      "description": "Network dependency, e.g. 'web fonts' or 'Chart.js + ECharts CDN'."
    },
    "gallery_file_zh": {
      "type": "string",
      "description": "templates/reports/report-NN.zh.html"
    },
    "gallery_file_en": {
      "type": "string",
      "description": "templates/reports/report-NN.en.html"
    },
    "origin": {
      "type": "string",
      "enum": ["upstream", "extension"]
    }
  }
}
